title,genre,director,writer,stars,IMDb rating,IMDb description,duration,content rating,year,month
"""Star Trek: Deep Space Nine"" The Search, Part II (TV Episode 1994) - IMDb","['Action', 'Adventure', 'Drama']",['Jonathan Frakes'],"['Gene Roddenberry', 'Rick Berman', 'Michael Piller']","['Avery Brooks', 'Rene Auberjonois', 'Alexander Siddig']",0.863157894736842,Odo has found his home and is introduced. Meanwhile Sisko finds out peace talks between the Dominion and the Federation have already started.,0.4380952380952381,0,1996,8
"""Futurama"" The Deep South (TV Episode 2000) - IMDb","['Animation', 'Adventure', 'Comedy']",['Bret Haaland'],"['Matt Groening', 'David X. Cohen', 'J. Stewart Burns']","['Billy West', 'Katey Sagal', 'John DiMaggio']",0.8210526315789474,"While stranded at the bottom of the Atlantic Ocean with the rest of the Planet Express crew, Fry meets a mermaid and quickly falls in love.",0.21904761904761905,1,2000,4
"""Star Trek: Enterprise"" Storm Front, Part II (TV Episode 2004) - IMDb","['Action', 'Adventure', 'Drama']",['David Straiton'],"['Gene Roddenberry', 'Rick Berman', 'Brannon Braga']","['Scott Bakula', 'John Billingsley', 'Jolene Blalock']",0.7684210526315789,"After Silik attacks Trip, Vosk wants to make a deal with Archer: supplies of the ship for the completion of his time machine in return for a trip to the 22nd Century.",0.4095238095238095,0,2005,2
"""The Twilight Zone"" The Parallel (TV Episode 1963) - IMDb","['Drama', 'Fantasy', 'Horror']",['Alan Crosland Jr.'],['Rod Serling'],"['Steve Forrest', 'Jacqueline Scott', 'Frank Aletter']",0.7999999999999999,Astronaut Robert Gaines returns from space to a world that is not exactly the one he left from.,0.4857142857142857,1,1963,3
"""The Twilight Zone"" Ninety Years Without Slumbering (TV Episode 1963) - IMDb","['Drama', 'Fantasy', 'Horror']",['Roger Kay'],"['Richard De Roy', 'George Clayton Johnson', 'Rod Serling']","['Ed Wynn', 'Carolyn Kearney', 'James T. Callahan']",0.7263157894736842,Lovable seventy-six-year-old clock maker Sam Forstman believes that his life will end at the very moment that his cherished family heirloom grandfather clock stops ticking.,0.23809523809523808,0,1963,12
"""Star Trek: The Animated Series"" One of Our Planets Is Missing (TV Episode 1973) - IMDb","['Animation', 'Action', 'Adventure']",['Hal Sutherland'],"['Gene Roddenberry', 'Marc Daniels', 'D.C. Fontana']","['William Shatner', 'Leonard Nimoy', 'DeForest Kelley']",0.7052631578947368,The crew of the Enterprise must stop a living planet-consuming cloud before it attacks an inhabited world.,0.22857142857142856,0,1973,9
"""Star Trek: Deep Space Nine"" Shadows and Symbols (TV Episode 1998) - IMDb","['Action', 'Adventure', 'Drama']",['Allan Kroeker'],"['Gene Roddenberry', 'Rick Berman', 'Michael Piller']","['Avery Brooks', 'Rene Auberjonois', 'Nicole de Boer']",0.8315789473684211,"Ezri Dax joins Sisko and his family on his quest for the Orb of the Emissary. Colonel Kira mounts a blockade around a Bajoran moon, where the Romulan hospital is - along with thousands of Romulan missles (claimed to be defensive i...",0.4380952380952381,0,1998,10
"""Star Trek: Deep Space Nine"" Crossfire (TV Episode 1996) - IMDb","['Action', 'Adventure', 'Drama']",['Les Landau'],"['Gene Roddenberry', 'Rick Berman', 'Michael Piller']","['Avery Brooks', 'Rene Auberjonois', 'Michael Dorn']",0.7473684210526316,"First Minister Shakaar visits the station, despite a threat of assassination. He falls in love with Kira much to Odo&apos;s dismay.",0.4380952380952381,0,1996,1
"""Star Trek: The Next Generation"" Where Silence Has Lease (TV Episode 1988) - IMDb","['Action', 'Adventure', 'Drama']",['Winrich Kolbe'],"['Gene Roddenberry', 'Jack B. Sowards']","['Patrick Stewart', 'Jonathan Frakes', 'LeVar Burton']",0.7368421052631579,"The Enterprise encounters a mysterious void in space and when they move in closer to investigate further, it envelops them and they can&apos;t get out.",0.42857142857142855,0,1993,7
"""The Twilight Zone"" A Stop at Willoughby (TV Episode 1960) - IMDb","['Drama', 'Fantasy', 'Horror']",['Robert Parrish'],['Rod Serling'],"['Rod Serling', 'James Daly', 'Howard Smith']",0.8947368421052632,"Tired of his miserable job and wife, a businessman starts dreaming on the train each night, about an old, idyllic town called Willoughby. Soon he has to know whether the town is real and fancies the thought of seeking refuge there.",0.23809523809523808,0,1990,6
"""The Twilight Zone"" The Lateness of the Hour (TV Episode 1960) - IMDb","['Drama', 'Fantasy', 'Horror']",['Jack Smight'],['Rod Serling'],"['Inger Stevens', 'John Hoyt', 'Irene Tedrow']",0.7473684210526316,"Daughter Jana of inventor Dr. William Loren objects to their &quot;perfect&quot; home, in which they are waited on hand and foot by mechanical servants that William has built.",0.23809523809523808,0,1960,12
"""Futurama"" The Cyber House Rules (TV Episode 2001) - IMDb","['Animation', 'Adventure', 'Comedy']",['Susie Dietter'],"['Matt Groening', 'David X. Cohen', 'Lew Morton']","['Billy West', 'Katey Sagal', 'John DiMaggio']",0.8105263157894737,"Leela returns to the Orphanarium and she meets with her friend Adlai Atkins after some years, and they begin to go out. Adlai is a surgeon and operates Leela to let her have two eyes, and Bender decides to adopt all the children a...",0.21904761904761905,1,2001,4
"""Star Trek: Deep Space Nine"" Visionary (TV Episode 1995) - IMDb","['Action', 'Adventure', 'Drama']",['Reza Badiyi'],"['Gene Roddenberry', 'Rick Berman', 'Michael Piller']","['Avery Brooks', 'Rene Auberjonois', 'Alexander Siddig']",0.8210526315789474,"While a Romulan delegation tries to get information about the Dominion, O&apos;Brien sees of unpleasant things that are about to happen in the future.",0.4380952380952381,0,1995,2
"""Star Trek: Voyager"" Twisted (TV Episode 1995) - IMDb","['Action', 'Adventure', 'Drama']",['Kim Friedman'],"['Gene Roddenberry', 'Rick Berman', 'Michael Piller']","['Kate Mulgrew', 'Robert Beltran', 'Roxann Dawson']",0.7263157894736842,A strange spatial distortion afflicts the ship and has the entire crew literally lost on their own ship.,0.4380952380952381,0,1995,10
"""The Twilight Zone"" Two (TV Episode 1961) - IMDb","['Drama', 'Fantasy', 'Horror']",['Montgomery Pittman'],"['Montgomery Pittman', 'Rod Serling']","['Elizabeth Montgomery', 'Charles Bronson', 'Rod Serling']",0.7894736842105263,"Two survivors of an apocalyptic battle, a man and a woman from opposing sides, approach each other suspiciously.",0.23809523809523808,0,1961,9
"""Futurama"" The Bots and the Bees (TV Episode 2012) - IMDb","['Animation', 'Adventure', 'Comedy']","['Stephen Sandoval', 'Peter Avanzino']","['Matt Groening', 'David X. Cohen', 'Eric Horsted']","['Billy West', 'Katey Sagal', 'John DiMaggio']",0.8105263157894737,Bender fathers a child with the office beverage machine.,0.20952380952380953,1,2012,6
"""Star Trek: The Next Generation"" Redemption (TV Episode 1991) - IMDb","['Action', 'Adventure', 'Drama']",['Cliff Bole'],"['Gene Roddenberry', 'Ronald D. Moore', 'Joe Menosky']","['Patrick Stewart', 'Jonathan Frakes', 'LeVar Burton']",0.8842105263157896,Both Captain Picard and Lt. Worf must decide where their priorities lie as the Klingon Empire descends into a bitter civil war.,0.42857142857142855,0,1991,6
"""Star Trek: The Next Generation"" The Price (TV Episode 1989) - IMDb","['Action', 'Adventure', 'Drama']",['Robert Scheerer'],"['Gene Roddenberry', 'Hannah Louise Shearer', 'Richard Danus']","['Patrick Stewart', 'Jonathan Frakes', 'LeVar Burton']",0.6631578947368421,"While the Enterprise hosts negotiations for control of a stable wormhole, Troi forms a personal relationship with an opposing negotiator, unaware of his true being.",0.42857142857142855,0,1994,7
"""The Twilight Zone"" No Time Like the Past (TV Episode 1963) - IMDb","['Drama', 'Fantasy', 'Horror']",['Justus Addiss'],['Rod Serling'],"['Dana Andrews', 'Patricia Breslin', 'Malcolm Atterbury']",0.7684210526315789,"A scientist attempts to use a time machine to prevent tragedies, both in world history and in his own past.",0.4857142857142857,0,1963,3
"""Star Trek: Deep Space Nine"" Move Along Home (TV Episode 1993) - IMDb","['Action', 'Adventure', 'Drama']",['David Carson'],"['Gene Roddenberry', 'Rick Berman', 'Michael Piller']","['Avery Brooks', 'Rene Auberjonois', 'Alexander Siddig']",0.6105263157894737,"The Wadi from the Gamma Quadrant visit DS9, thereby making first contact with the Federation. When they catch Quark cheating, they let him off by playing a special game.",0.4380952380952381,0,1995,11
"""Star Trek: The Next Generation"" The High Ground (TV Episode 1990) - IMDb","['Action', 'Adventure', 'Drama']",['Gabrielle Beaumont'],"['Gene Roddenberry', 'Melinda M. Snodgrass', 'Richard Danus']","['Patrick Stewart', 'Jonathan Frakes', 'LeVar Burton']",0.7157894736842105,"While visiting a planet under civil war, Dr. Crusher is taken hostage by an opposing faction of the planet&apos;s ruling government.",0.42857142857142855,0,1994,8
"""Star Trek: Voyager"" Fair Trade (TV Episode 1997) - IMDb","['Action', 'Adventure', 'Drama']",['Jesús Salvador Treviño'],"['Gene Roddenberry', 'Rick Berman', 'Michael Piller']","['Kate Mulgrew', 'Robert Beltran', 'Roxann Dawson']",0.7052631578947368,"Voyager heads into a section of space that Neelix has no knowledge of, so he tries to obtain a map of it from a less-than-reputable friend.",0.4380952380952381,0,1997,1
"""Star Trek: Deep Space Nine"" Badda-Bing, Badda-Bang (TV Episode 1999) - IMDb","['Action', 'Adventure', 'Drama']",['Michael Vejar'],"['Gene Roddenberry', 'Rick Berman', 'Michael Piller']","['Avery Brooks', 'Rene Auberjonois', 'Nicole de Boer']",0.7999999999999999,"When a programming glitch won&apos;t go away, mobsters take over Vic&apos;s and open for business, but the DS9 gang takes it personal when their favorite hangout is no longer their favorite, and they plan to get the new management ousted.",0.4380952380952381,0,1999,2
"""Star Trek: The Animated Series"" How Sharper Than a Serpent's Tooth (TV Episode 1974) - IMDb","['Animation', 'Action', 'Adventure']","['Bill Reed', 'Hal Sutherland']","['Gene Roddenberry', 'Russell Bates', 'David Wise']","['William Shatner', 'Leonard Nimoy', 'DeForest Kelley']",0.6736842105263158,The Enterprise runs into a being which once visited Earth and influenced the Mayan culture.,0.21904761904761905,0,1974,10
"""The Twilight Zone"" The Bewitchin' Pool (TV Episode 1964) - IMDb","['Drama', 'Fantasy', 'Horror']",['Joseph M. Newman'],"['Earl Hamner Jr.', 'Rod Serling']","['Mary Badham', 'Dee Hartford', 'Tod Andrews']",0.6842105263157895,Two children escape their bickering parents through a portal in the bottom of their swimming pool to a magical land watched over by a kind old woman the children call Aunt T.,0.23809523809523808,0,1964,6
"""Futurama"" T.: The Terrestrial (TV Episode 2013) - IMDb","['Animation', 'Adventure', 'Comedy']","['Lance Kramer', 'Peter Avanzino']","['Matt Groening', 'David X. Cohen', 'Josh Weinstein']","['Billy West', 'Katey Sagal', 'John DiMaggio']",0.7684210526315789,"The crew goes to Omicron Persei 8, where Fry is left behind, and rescued by a local boy, but his only wish is to go home.",0.20952380952380953,1,2013,6
"""The Twilight Zone"" You Drive (TV Episode 1964) - IMDb","['Drama', 'Fantasy', 'Horror']",['John Brahm'],"['Earl Hamner Jr.', 'Rod Serling']","['Edward Andrews', 'Helen Westcott', 'Kevin Hagen']",0.7894736842105263,"After causing a hit-and-run motor vehicle accident that killed a bike-riding child, then letting his co-worker Pete Radcliffe take the blame, office manager Oliver Pope is relentlessly haunted by his suddenly aggressive car.",0.23809523809523808,0,1964,1
"""Futurama"" The Problem with Popplers (TV Episode 2000) - IMDb","['Animation', 'Adventure', 'Comedy']","['Chris Sauve', 'Gregg Vanzo', 'Bret Haaland']","['Matt Groening', 'David X. Cohen', 'Patric M. Verrone']","['Billy West', 'Katey Sagal', 'John DiMaggio']",0.8947368421052632,"The Planet Express crew discovers a delicious snack food on a remote planet, but Leela has a change of heart when she discovers a disturbing fact about the snack food that endangers Earth.",0.21904761904761905,1,2000,5
"""Star Trek: Deep Space Nine"" Covenant (TV Episode 1998) - IMDb","['Action', 'Adventure', 'Drama']",['John T. Kretchmer'],"['Gene Roddenberry', 'Rick Berman', 'Michael Piller']","['Avery Brooks', 'Rene Auberjonois', 'Nicole de Boer']",0.6947368421052631,Kira is kidnapped and taken to Empok Nor by a member of a Pah&apos;Wraith cult and discovers the group leader is Gul Dukat.,0.4380952380952381,0,1998,11
"""Star Trek: The Next Generation"" Conundrum (TV Episode 1992) - IMDb","['Action', 'Adventure', 'Drama']",['Les Landau'],"['Gene Roddenberry', 'Barry M. Schkolnick', 'Paul Schiffer']","['Patrick Stewart', 'Jonathan Frakes', 'LeVar Burton']",0.863157894736842,"When an approaching alien ship wipes their memory, the crew struggles to put back together what happened.",0.4380952380952381,0,1992,2
"""Futurama"" The Inhuman Torch (TV Episode 2013) - IMDb","['Animation', 'Adventure', 'Comedy']",['Frank Marino'],"['Matt Groening', 'David X. Cohen', 'Dan Vebber']","['Billy West', 'Katey Sagal', 'John DiMaggio']",0.7578947368421053,"Bender accidentally becomes a firefighting hero, and loves it so much that he becomes a full-time firefighter. And he has plenty of opportunities to display his heroism, because fires mysteriously start everywhere he goes.",0.20952380952380953,1,2013,7
"""Star Trek: Deep Space Nine"" Looking for Par'Mach in All the Wrong Places (TV Episode 1996) - IMDb","['Action', 'Adventure', 'Drama']",['Andrew Robinson'],"['Gene Roddenberry', 'Rick Berman', 'Michael Piller']","['Avery Brooks', 'Rene Auberjonois', 'Michael Dorn']",0.7999999999999999,"While Worf helps Quark to pursue his former wife Grilka, O&apos;Brien and Kira grow uncomfortably close to each other.",0.4380952380952381,0,1996,10
"""Star Trek: Deep Space Nine"" Little Green Men (TV Episode 1995) - IMDb","['Action', 'Adventure', 'Drama']",['James L. Conway'],"['Gene Roddenberry', 'Rick Berman', 'Michael Piller']","['Avery Brooks', 'Rene Auberjonois', 'Michael Dorn']",0.8842105263157896,"Quark and Rom take Nog to Earth and Starfleet Academy, but a malfunction with the ship takes the crew back in time, to Roswell, New Mexico in 1947.",0.42857142857142855,0,1995,11
"""Star Trek: Deep Space Nine"" The Abandoned (TV Episode 1994) - IMDb","['Action', 'Adventure', 'Drama']",['Avery Brooks'],"['Gene Roddenberry', 'Rick Berman', 'Michael Piller']","['Avery Brooks', 'Rene Auberjonois', 'Alexander Siddig']",0.7263157894736842,"Odo tries to change the nature of a rapidly maturing infant Quark finds, while Sisko tries to break his son&apos;s relationship with a 20 year old Dabo girl.",0.4380952380952381,0,1994,10
"""Star Trek: The Next Generation"" Transfigurations (TV Episode 1990) - IMDb","['Action', 'Adventure', 'Drama']",['Tom Benko'],"['Gene Roddenberry', 'René Echevarria', 'Ronald D. Moore']","['Patrick Stewart', 'Jonathan Frakes', 'LeVar Burton']",0.7263157894736842,"The Enterprise finds a deserted planet where a ship has crashed, and, with it, the lone survivor with no memory, but extraordinary healing powers.",0.4380952380952381,0,1995,8
"""Star Trek"" Where No Man Has Gone Before (TV Episode 1966) - IMDb","['Action', 'Adventure', 'Sci-Fi']",['James Goldstone'],"['Samuel A. Peeples', 'Gene Roddenberry']","['William Shatner', 'Leonard Nimoy', 'Gary Lockwood']",0.8105263157894737,The flight recorder of the 200-year-old U.S.S. Valiant relays a tale of terror--a magnetic storm at the edge of the galaxy.,0.47619047619047616,0,1966,9
"""Futurama"" The Tip of the Zoidberg (TV Episode 2011) - IMDb","['Animation', 'Adventure', 'Comedy']","['Raymie Muzquiz', 'Peter Avanzino']","['Matt Groening', 'David X. Cohen', 'Ken Keeler']","['Billy West', 'Katey Sagal', 'John DiMaggio']",0.8105263157894737,"The Professor consistently refuses to fire Zoidberg, despite his complete incompetence in medicine. The reason for such devotion is finally revealed.",0.20952380952380953,1,2011,8
"""Star Trek: Voyager"" Future's End, Part II (TV Episode 1996) - IMDb","['Action', 'Adventure', 'Drama']",['Cliff Bole'],"['Gene Roddenberry', 'Rick Berman', 'Michael Piller']","['Kate Mulgrew', 'Robert Beltran', 'Roxann Dawson']",0.8526315789473684,"As the Voyager crew pit their 24th century technology against Starling&apos;s stolen 29th century technology, Chakotay and Torres fall into the hands of paranoid white supremacists.",0.4380952380952381,0,1996,11
"""Star Trek: Deep Space Nine"" The Search, Part I (TV Episode 1994) - IMDb","['Action', 'Adventure', 'Drama']",['Kim Friedman'],"['Gene Roddenberry', 'Rick Berman', 'Michael Piller']","['Avery Brooks', 'Rene Auberjonois', 'Alexander Siddig']",0.8736842105263158,"Instead of waiting for the Jem&apos;Hadar to attack, Sisko wants to try a different tactic; he wants to take a new class starship to try to find the Founders.",0.4380952380952381,0,1996,7
"""The Twilight Zone"" The Shelter (TV Episode 1961) - IMDb","['Drama', 'Fantasy', 'Horror']",['Lamont Johnson'],['Rod Serling'],"['Larry Gates', 'Joseph Bernard', 'Jack Albertson']",0.9052631578947368,"A dinner party for Bill Stockton&apos;s birthday is interrupted by a bulletin warning of an impending nuclear attack. As the neighbors scramble to prepare, they turn against the Stockton&apos;s, the only family that installed a bomb shelter.",0.23809523809523808,0,1961,9
"""Star Trek: The Next Generation"" Justice (TV Episode 1987) - IMDb","['Action', 'Adventure', 'Drama']",['James L. Conway'],"['Gene Roddenberry', 'Worley Thorne', 'John D.F. Black']","['Patrick Stewart', 'Jonathan Frakes', 'LeVar Burton']",0.631578947368421,"On an alien planet, young Wesley Crusher commits a transgression - small by our standards but mandatorily punishable by death in theirs.",0.4380952380952381,0,1992,7
"""Star Trek: The Next Generation"" Sins of the Father (TV Episode 1990) - IMDb","['Action', 'Adventure', 'Drama']",['Les Landau'],"['Gene Roddenberry', 'Ronald D. Moore', 'W. Reed Moran']","['Patrick Stewart', 'Jonathan Frakes', 'LeVar Burton']",0.863157894736842,"A Klingon commander comes aboard the Enterprise in an officer exchange program initiated by Starfleet, much to the chagrin of the crew.",0.42857142857142855,0,1995,6
"""Star Trek: The Next Generation"" A Matter of Time (TV Episode 1991) - IMDb","['Action', 'Adventure', 'Drama']",['Paul Lynch'],"['Gene Roddenberry', 'Rick Berman', 'Brannon Braga']","['Patrick Stewart', 'Jonathan Frakes', 'LeVar Burton']",0.7578947368421053,"Reaching Penthara IV after an asteroid wreaks havoc of catastrophic proportions, the Enterprise crew deals with trying to save the planet as well as deal with someone who claims to be a historian from the future.",0.42857142857142855,0,1991,11
"""Futurama"" Hell Is Other Robots (TV Episode 1999) - IMDb","['Animation', 'Adventure', 'Comedy']","['Gregg Vanzo', 'Rich Moore']","['Matt Groening', 'David X. Cohen', 'Eric Kaplan']","['Billy West', 'Katey Sagal', 'John DiMaggio']",0.8421052631578947,"Bender joins a robot church after fighting an addiction to electricity, but reverts to his pre-addictive behavior of cigars, booze and robot hookers, leading to a musical confrontation with the Robot Devil.",0.21904761904761905,1,1999,5
"""The Twilight Zone"" Sounds and Silences (TV Episode 1964) - IMDb","['Drama', 'Fantasy', 'Horror']",['Richard Donner'],['Rod Serling'],"['John McGiver', 'Michael Fox', 'Renee Aubry']",0.6,"Retired Navy man and current model ship manufacturing company owner Roswell Flemington enjoys loud noises, is an annoyance to others, drives his wife to leave him, and is suitably punished with a full dose of irony.",0.23809523809523808,0,1964,4
"""Star Trek: Enterprise"" Hatchery (TV Episode 2004) - IMDb","['Action', 'Adventure', 'Drama']",['Michael Grossman'],"['Gene Roddenberry', 'Rick Berman', 'Brannon Braga']","['Scott Bakula', 'John Billingsley', 'Jolene Blalock']",0.6947368421052631,Captain Archer orders the crew of Enterprise to save a Xindi-Insectoid hatchery.,0.4095238095238095,0,2004,9
"""Star Trek: Deep Space Nine"" Nor the Battle to the Strong (TV Episode 1996) - IMDb","['Action', 'Adventure', 'Drama']",['Kim Friedman'],"['Gene Roddenberry', 'Rick Berman', 'Michael Piller']","['Avery Brooks', 'Rene Auberjonois', 'Michael Dorn']",0.7894736842105263,"Jake, reporting from the front lines, sees what war truly is.",0.4380952380952381,0,1996,10
"""Star Trek: Enterprise"" Twilight (TV Episode 2003) - IMDb","['Action', 'Adventure', 'Drama']",['Robert Duncan McNeill'],"['Gene Roddenberry', 'Rick Berman', 'Brannon Braga']","['Scott Bakula', 'John Billingsley', 'Jolene Blalock']",0.9052631578947368,"His memory crippled, Archer awakens years in the future, after the Xindi have reduced Earth to a cinder and the remnants of humanity have settled on a distant planet. Now, Archer learns that he may be the key to undoing this tragedy.",0.4095238095238095,0,2004,7
"""Star Trek: Enterprise"" Canamar (TV Episode 2003) - IMDb","['Action', 'Adventure', 'Drama']",['Allan Kroeker'],"['Gene Roddenberry', 'Rick Berman', 'Brannon Braga']","['Scott Bakula', 'John Billingsley', 'Jolene Blalock']",0.7157894736842105,"Archer and Trip are accused of smuggling and sent to the penal colony Canamar. While Enterprise manages to negotiate their release, a mutiny breaks out on the prison ship.",0.4095238095238095,0,2004,3
"""Star Trek: Voyager"" The Voyager Conspiracy (TV Episode 1999) - IMDb","['Action', 'Adventure', 'Drama']",['Terry Windell'],"['Gene Roddenberry', 'Rick Berman', 'Michael Piller']","['Kate Mulgrew', 'Robert Beltran', 'Roxann Dawson']",0.7789473684210527,"Modifying her alcove to process several months of gathered data at a time turns Seven into a rampant conspiracy theorist. Meanwhile, Janeway deals with an alien scientist developing catapult technology.",0.41904761904761906,0,1999,11
"""Star Trek: Deep Space Nine"" The Forsaken (TV Episode 1993) - IMDb","['Action', 'Adventure', 'Drama']",['Les Landau'],"['Gene Roddenberry', 'Rick Berman', 'Michael Piller']","['Avery Brooks', 'Rene Auberjonois', 'Alexander Siddig']",0.7263157894736842,"Lwaxana Troi comes for a political visit and instead hounds Odo for romantic attention. Meanwhile, an alien probe wreaks havoc with the station&apos;s computer, leaving Odo and Lwaxana trapped together.",0.4380952380952381,0,1995,12
"""Star Trek"" The Cage (TV Episode 1966) - IMDb","['Action', 'Adventure', 'Sci-Fi']",['Robert Butler'],['Gene Roddenberry'],"['Jeffrey Hunter', 'Susan Oliver', 'Leonard Nimoy']",0.7999999999999999,Capt. Pike is held prisoner and tested by aliens who have the power to project incredibly lifelike illusions.,0.6,0,1988,10
"""Star Trek: Voyager"" In the Flesh (TV Episode 1998) - IMDb","['Action', 'Adventure', 'Drama']",['David Livingston'],"['Gene Roddenberry', 'Rick Berman', 'Michael Piller']","['Kate Mulgrew', 'Robert Beltran', 'Roxann Dawson']",0.8210526315789474,"The Voyager crew discovers Species 8472 training to pose as human beings in a recreation of Starfleet Headquarters, a prelude to infiltration.",0.4380952380952381,0,1998,11
"""Star Trek: Deep Space Nine"" Trials and Tribble-ations (TV Episode 1996) - IMDb","['Action', 'Adventure', 'Drama']",['Jonathan West'],"['Gene Roddenberry', 'Rick Berman', 'Michael Piller']","['Avery Brooks', 'Rene Auberjonois', 'Michael Dorn']",0.9789473684210527,Sisko tells two men from Temporal Investigations how he and his crew went back in time to when Captain James Kirk of the first Starship Enterprise exposed a Klingon spy with the help of Tribbles.,0.42857142857142855,0,1996,11
"""Star Trek: The Next Generation"" The Next Phase (TV Episode 1992) - IMDb","['Action', 'Adventure', 'Drama']",['David Carson'],"['Gene Roddenberry', 'Ronald D. Moore', 'Brannon Braga']","['Patrick Stewart', 'Jonathan Frakes', 'LeVar Burton']",0.8736842105263158,"A transporter malfunction, combined with a Romulan ship under stress and a damaged cloaking device, creates the illusion that Ensign Ro and Geordi are dead, but Geordi doesn&apos;t believe it to be so, and he acts accordingly.",0.4380952380952381,0,1992,5
"""Star Trek: Deep Space Nine"" The Alternate (TV Episode 1994) - IMDb","['Action', 'Adventure', 'Drama']",['David Carson'],"['Gene Roddenberry', 'Rick Berman', 'Michael Piller']","['Avery Brooks', 'Rene Auberjonois', 'Alexander Siddig']",0.7052631578947368,Odo and his mentor Dr. Mora Pol discover a lifeform similar to Odo on a Gamma Quadrant planet.,0.42857142857142855,0,1996,4
"""Star Trek: Enterprise"" These Are the Voyages... (TV Episode 2005) - IMDb","['Action', 'Adventure', 'Drama']",['Allan Kroeker'],"['Gene Roddenberry', 'Rick Berman', 'Brannon Braga']","['Scott Bakula', 'John Billingsley', 'Jolene Blalock']",0.5578947368421052,"In 2370, Commander William T. Riker is trying to clear his mind and relives the last mission of the first Enterprise on the holodeck.",0.4095238095238095,0,2005,11
"""Star Trek: Deep Space Nine"" Heart of Stone (TV Episode 1995) - IMDb","['Action', 'Adventure', 'Drama']",['Alexander Singer'],"['Gene Roddenberry', 'Rick Berman', 'Michael Piller']","['Avery Brooks', 'Rene Auberjonois', 'Alexander Siddig']",0.7684210526315789,"After chasing a fugitive into a cave, Kira gets stuck and is slowly encapsulated by a growing crystal stone while Odo tries to figure out how to free her.",0.4380952380952381,0,1995,2
"""The Twilight Zone"" The Man in the Bottle (TV Episode 1960) - IMDb","['Drama', 'Fantasy', 'Horror']",['Don Medford'],['Rod Serling'],"['Luther Adler', 'Vivi Janiss', 'Joseph Ruskin']",0.7789473684210527,"A luckless couple stumbles upon fortune when a genie materializes from a bottle in their antique shop. The genie grants them four wishes but warns them, prophetically, to be careful what you wish for.",0.23809523809523808,0,1960,10
