title,genre,director,writer,stars,IMDb rating,IMDb description,duration,content rating,year,month
"""The Twilight Zone"" Living Doll (TV Episode 1963) - IMDb","['Drama', 'Fantasy', 'Horror']",['Richard C. Sarafian'],"['Charles Beaumont', 'Rod Serling', 'Jerry Sohl']","['Telly Savalas', 'Mary LaRoche', 'Tracy Stratford']",0.9157894736842105,"Frustrated Erich Streator does battle with his stepdaughter Christie&apos;s talking doll Talky Tina, whose vocabulary includes such unconventional phrases as &quot;I hate you&quot; and &quot;I&apos;m going to kill you&quot;.",0.24761904761904763,0,1963,11
"""Star Trek"" The Empath (TV Episode 1968) - IMDb","['Action', 'Adventure', 'Sci-Fi']",['John Erman'],"['Gene Roddenberry', 'Joyce Muskat', 'Arthur H. Singer']","['William Shatner', 'Leonard Nimoy', 'DeForest Kelley']",0.6842105263157895,"Trapped in an alien laboratory, Kirk, Spock and McCoy meet an empath and are involved in a series of experiments.",0.4857142857142857,0,1968,12
"""Star Trek: The Next Generation"" Time's Arrow (TV Episode 1992) - IMDb","['Action', 'Adventure', 'Drama']",['Les Landau'],"['Gene Roddenberry', 'Joe Menosky', 'Michael Piller']","['Patrick Stewart', 'Jonathan Frakes', 'LeVar Burton']",0.8736842105263158,Captain Picard and his archaeological curiosity are called upon by scientists from Earth when they find evidence to support beliefs that aliens had visited Earth in the late 1800s.,0.42857142857142855,0,1992,6
"""The Twilight Zone"" Five Characters in Search of an Exit (TV Episode 1961) - IMDb","['Drama', 'Fantasy', 'Horror']",['Lamont Johnson'],"['Rod Serling', 'Marvin Petal']","['Susan Harrison', 'William Windom', 'Murray Matheson']",0.8947368421052632,"An Army major awakens in a small room with no idea of who he is or how he got there. He finds four other people in the same room, and they all begin to question how they each arrived there, and more importantly, how to escape.",0.23809523809523808,0,1961,12
"""Star Trek: The Next Generation"" Unification I (TV Episode 1991) - IMDb","['Action', 'Adventure', 'Drama']",['Les Landau'],"['Gene Roddenberry', 'Jeri Taylor', 'Rick Berman']","['Patrick Stewart', 'Jonathan Frakes', 'LeVar Burton']",0.863157894736842,Picard and Data follow Spock into Romulan space on a dangerous mission.,0.42857142857142855,0,1991,11
"""Star Trek: Enterprise"" Precious Cargo (TV Episode 2002) - IMDb","['Action', 'Adventure', 'Drama']",['David Livingston'],"['Gene Roddenberry', 'Rick Berman', 'Brannon Braga']","['Scott Bakula', 'John Billingsley', 'Jolene Blalock']",0.6736842105263158,"While Trip is repairing a stasis pod at a Retellian cargo ship and the woman inside, heir apparent to the throne of Krios, wakes up, the ship makes a hasty departure. Trip must make a plan to escape.",0.4095238095238095,0,2002,12
"""Star Trek: The Next Generation"" Relics (TV Episode 1992) - IMDb","['Action', 'Adventure', 'Drama']",['Alexander Singer'],"['Gene Roddenberry', 'Ronald D. Moore', 'Brannon Braga']","['Patrick Stewart', 'Jonathan Frakes', 'LeVar Burton']",0.8947368421052632,"The Enterprise stumbles upon a Dyson sphere, with a ship crashed on the outer surface. An away team finds some systems still powered up and the chief engineer from the old Enterprise, Montgomery Scott, locked in the transporter cy...",0.42857142857142855,0,1992,10
"""Star Trek: The Animated Series"" The Magicks of Megas-Tu (TV Episode 1973) - IMDb","['Animation', 'Action', 'Adventure']",['Hal Sutherland'],"['Gene Roddenberry', 'Larry Brody', 'D.C. Fontana']","['William Shatner', 'Leonard Nimoy', 'DeForest Kelley']",0.6210526315789474,"At the centre of the galaxy, a race puts the Enterprise crew on trial for past grievances.",0.21904761904761905,0,1973,10
"""The Twilight Zone"" Nightmare at 20,000 Feet (TV Episode 1963) - IMDb","['Drama', 'Fantasy', 'Horror']",['Richard Donner'],"['Richard Matheson', 'Rod Serling']","['William Shatner', 'Christine White', 'Ed Kemmer']",0.9473684210526315,"A man, newly recovered from a nervous breakdown, becomes convinced that a monster only he sees is damaging the plane he&apos;s flying in.",0.23809523809523808,0,1963,10
"""Futurama"" Meanwhile (TV Episode 2013) - IMDb","['Animation', 'Adventure', 'Comedy']",['Peter Avanzino'],"['Matt Groening', 'David X. Cohen', 'Ken Keeler']","['Billy West', 'Katey Sagal', 'John DiMaggio']",0.9894736842105264,"Professor Farnsworth invents a button that can take a person 10 seconds back in time, inadvertently causing major consequences.",0.20952380952380953,1,2013,9
"""Star Trek: Enterprise"" The Crossing (TV Episode 2003) - IMDb","['Action', 'Adventure', 'Drama']",['David Livingston'],"['Gene Roddenberry', 'Rick Berman', 'Brannon Braga']","['Scott Bakula', 'John Billingsley', 'Jolene Blalock']",0.7263157894736842,Enterprise is held captive by non-corporeal beings who claim to be explorers.,0.4095238095238095,0,2004,3
"""The Twilight Zone"" A Short Drink from a Certain Fountain (TV Episode 1963) - IMDb","['Drama', 'Fantasy', 'Horror']",['Bernard Girard'],"['Rod Serling', 'Lou Holtz']","['Patrick O&apos;Neal', 'Ruta Lee', 'Walter Brooke']",0.7368421052631579,Aging Harmon Gordon convinces his brother Dr. Raymond Gordon to inject him with an experimental youth serum so that Harmon will have sufficient energy to keep up with his much younger gold-digging wife Flora.,0.23809523809523808,0,1963,12
"""Star Trek: The Next Generation"" Violations (TV Episode 1992) - IMDb","['Action', 'Adventure', 'Drama']",['Robert Wiemer'],"['Gene Roddenberry', 'Pamela Gray', 'Jeri Taylor']","['Patrick Stewart', 'Jonathan Frakes', 'LeVar Burton']",0.6526315789473685,"Transporting three Ullian mind-probing historians, the Enterprise crew is stymied when some of its members fall into a coma. Deanna Troi, the first crew member to come through it, cannot recall anything surrounding the incident.",0.42857142857142855,0,1992,2
"""Star Trek: Voyager"" Repression (TV Episode 2000) - IMDb","['Action', 'Adventure', 'Drama']",['Winrich Kolbe'],"['Gene Roddenberry', 'Rick Berman', 'Michael Piller']","['Kate Mulgrew', 'Robert Beltran', 'Roxann Dawson']",0.6947368421052631,Security officer Tuvok investigates a strange series of attacks on Voyager directed at the former Maquis members.,0.4095238095238095,0,2000,10
"""The Twilight Zone"" The Passersby (TV Episode 1961) - IMDb","['Drama', 'Fantasy', 'Horror']",['Elliot Silverstein'],['Rod Serling'],"['James Gregory', 'Joanne Linville', 'Rex Holman']",0.7894736842105263,A crippled soldier drops out of a marching column and meets a widowed woman.,0.23809523809523808,0,1961,10
"""Star Trek: Voyager"" Alice (TV Episode 1999) - IMDb","['Action', 'Adventure', 'Drama']",['David Livingston'],"['Gene Roddenberry', 'Rick Berman', 'Michael Piller']","['Kate Mulgrew', 'Robert Beltran', 'Roxann Dawson']",0.6631578947368421,Voyager takes on a &quot;haunted&quot; hot rod alien spacecraft with a possessiveness artificial intelligence that jealously bonds with Tom Paris.,0.4095238095238095,0,1999,10
"""Star Trek"" Let That Be Your Last Battlefield (TV Episode 1969) - IMDb","['Action', 'Adventure', 'Sci-Fi']",['Jud Taylor'],"['Gene Roddenberry', 'Oliver Crawford', 'Gene L. Coon']","['William Shatner', 'Leonard Nimoy', 'DeForest Kelley']",0.7473684210526316,The Enterprise encounters two duo-chromatic and mutually belligerent aliens who put the ship in the middle of their old conflict.,0.4857142857142857,0,1969,1
"""Star Trek: The Next Generation"" Cost of Living (TV Episode 1992) - IMDb","['Action', 'Adventure', 'Drama']",['Winrich Kolbe'],"['Gene Roddenberry', 'Peter Allan Fields', 'Brannon Braga']","['Patrick Stewart', 'Jonathan Frakes', 'LeVar Burton']",0.6421052631578947,"As undetectable parasites devour the ship, Deanna&apos;s mother arrives, taking young Alexander under her wing en route to meeting a man she&apos;s blindly agreed to marry.",0.4380952380952381,0,1992,4
"""The Twilight Zone"" The Fever (TV Episode 1960) - IMDb","['Drama', 'Fantasy', 'Horror']",['Robert Florey'],['Rod Serling'],"['Rod Serling', 'Everett Sloane', 'Vivi Janiss']",0.6947368421052631,A middle-aged man catches gambling fever from a slot machine that he believes is calling his name.,0.23809523809523808,0,1960,1
"""Star Trek"" Amok Time (TV Episode 1967) - IMDb","['Action', 'Adventure', 'Sci-Fi']",['Joseph Pevney'],"['Gene Roddenberry', 'Theodore Sturgeon']","['William Shatner', 'Leonard Nimoy', 'DeForest Kelley']",0.9052631578947368,"In the throes of his Pon Farr mating period, Spock must return to Vulcan to meet his intended future wife, betrothed from childhood.",0.47619047619047616,0,1967,9
"""Star Trek: Enterprise"" Cold Front (TV Episode 2001) - IMDb","['Action', 'Adventure', 'Drama']",['Robert Duncan McNeill'],"['Gene Roddenberry', 'Rick Berman', 'Brannon Braga']","['Scott Bakula', 'John Billingsley', 'Jolene Blalock']",0.7999999999999999,"Enterprise has a group of aliens watching a stellar phenomenon on board. When the ship is miraculously saved from blowing up, crewman Daniels has an important message for Archer.",0.42857142857142855,0,2003,11
"""Futurama"" Where the Buggalo Roam (TV Episode 2002) - IMDb","['Animation', 'Adventure', 'Comedy']",['Patty Shinagawa'],"['Matt Groening', 'David X. Cohen', 'J. Stewart Burns']","['Billy West', 'Katey Sagal', 'John DiMaggio']",0.7894736842105263,"Intern Amy Wong&apos;s rich parents host the annual Mars Day picnic, but the original Martians have different plans, so Lieutenant Kif Kroker comes to the rescue.",0.21904761904761905,0,2002,3
"""The Twilight Zone"" The Incredible World of Horace Ford (TV Episode 1963) - IMDb","['Drama', 'Fantasy', 'Horror']",['Abner Biberman'],"['Reginald Rose', 'Rod Serling']","['Pat Hingle', 'Nan Martin', 'Ruth White']",0.6526315789473685,"Toymaker Horace Ford is increasingly preoccupied with memories of his childhood, endangering his job and marriage - but a visit to his old neighborhood brings a haunting encounter, suggesting the time was not as idyllic as he reme...",0.4857142857142857,1,1963,4
"""Star Trek"" Who Mourns for Adonais? (TV Episode 1967) - IMDb","['Action', 'Adventure', 'Sci-Fi']",['Marc Daniels'],"['Gene Roddenberry', 'Gilbert Ralston']","['William Shatner', 'Leonard Nimoy', 'DeForest Kelley']",0.7473684210526316,A powerful being claiming to be the Greek god Apollo appears and demands that the crew of the Enterprise disembark onto his planet to worship him.,0.47619047619047616,0,1967,9
"""Star Trek"" Court Martial (TV Episode 1967) - IMDb","['Action', 'Adventure', 'Sci-Fi']",['Marc Daniels'],"['Don Mankiewicz', 'Steven W. Carabatsos', 'Gene Roddenberry']","['William Shatner', 'Leonard Nimoy', 'Percy Rodrigues']",0.7789473684210527,Kirk draws a court martial in the negligent death of a crewman.,0.47619047619047616,0,1967,2
"""Star Trek: Voyager"" Ashes to Ashes (TV Episode 2000) - IMDb","['Action', 'Adventure', 'Drama']",['Terry Windell'],"['Gene Roddenberry', 'Rick Berman', 'Michael Piller']","['Kate Mulgrew', 'Robert Beltran', 'Roxann Dawson']",0.7263157894736842,"Voyager receives a former crewman, deceased, resurrected, genetically altered, unrecognizable, and glad to be &quot;home.&quot; Meanwhile, looking after the Borg children exasperates Seven of Nine.",0.41904761904761906,0,2000,3
"""Star Trek"" Requiem for Methuselah (TV Episode 1969) - IMDb","['Action', 'Adventure', 'Sci-Fi']",['Murray Golden'],"['Gene Roddenberry', 'Jerome Bixby', 'Arthur H. Singer']","['William Shatner', 'Leonard Nimoy', 'DeForest Kelley']",0.7684210526315789,"On a planet, looking for an urgent medicinal cure, Kirk, Spock and McCoy come across a dignified recluse living privately but in splendor with his sheltered ward and a very protective robot servant.",0.4857142857142857,0,1969,2
"""Star Trek: The Next Generation"" Angel One (TV Episode 1988) - IMDb","['Action', 'Adventure', 'Drama']",['Michael Ray Rhodes'],"['Gene Roddenberry', 'Patrick Barry', 'Tracy Tormé']","['Patrick Stewart', 'Jonathan Frakes', 'LeVar Burton']",0.6,"Riker, Troi, Data and Yar beam down to a planet ruled by a matriarchal government in the hopes of locating a missing freighter crew.",0.4380952380952381,0,1992,6
"""Star Trek: Voyager"" Bride of Chaotica! (TV Episode 1999) - IMDb","['Action', 'Adventure', 'Drama']",['Allan Kroeker'],"['Gene Roddenberry', 'Rick Berman', 'Michael Piller']","['Kate Mulgrew', 'Robert Beltran', 'Roxann Dawson']",0.7684210526315789,The Voyager crew encounters photonic life forms that mistake warmongering characters as real in Tom Paris&apos; far-fetched &quot;Captain Proton&quot; holodeck program.,0.4380952380952381,0,1999,1
"""Futurama"" Mars University (TV Episode 1999) - IMDb","['Animation', 'Adventure', 'Comedy']","['Bret Haaland', 'Rich Moore', 'Gregg Vanzo']","['Matt Groening', 'David X. Cohen', 'J. Stewart Burns']","['Billy West', 'Katey Sagal', 'John DiMaggio']",0.8105263157894737,Fry enrolls at Mars University and competes with a monkey made smart by Prof. Farnsworth&apos;s latest invention while Bender tries to make the local chapter of his robot fraternity cool.,0.21904761904761905,1,1999,10
"""Star Trek: Enterprise"" Carpenter Street (TV Episode 2003) - IMDb","['Action', 'Adventure', 'Drama']",['Michael Vejar'],"['Gene Roddenberry', 'Rick Berman', 'Brannon Braga']","['Scott Bakula', 'John Billingsley', 'Jolene Blalock']",0.7789473684210527,Archer and T&apos;Pol travel back in time to Detroit in 2004 to stop three Xindi-Reptilians from constructing a bioweapon.,0.4095238095238095,1,2004,8
"""Futurama"" The Late Philip J. Fry (TV Episode 2010) - IMDb","['Animation', 'Adventure', 'Comedy']",['Peter Avanzino'],"['Matt Groening', 'David X. Cohen', 'Lew Morton']","['Billy West', 'Katey Sagal', 'John DiMaggio']",0.9789473684210527,"Fry agrees to travel one minute into the future in Farnsworth&apos;s new time machine right before a big date with Leela, but they wind up going far into the future with no way to go back in time.",0.20952380952380953,1,2010,7
"""Star Trek: The Next Generation"" Yesterday's Enterprise (TV Episode 1990) - IMDb","['Action', 'Adventure', 'Drama']",['David Carson'],"['Gene Roddenberry', 'Ira Steven Behr', 'Richard Manning']","['Patrick Stewart', 'Jonathan Frakes', 'LeVar Burton']",0.9684210526315788,"The Enterprise C enters the Enterprise D&apos;s time and space continuum, where they find Picard and crew in a constant state of war with the Klingons, and only Guinan knows it.",0.4380952380952381,0,1994,9
"""Star Trek: The Next Generation"" The Big Goodbye (TV Episode 1988) - IMDb","['Action', 'Adventure', 'Drama']",['Joseph L. Scanlan'],"['Gene Roddenberry', 'Tracy Tormé']","['Patrick Stewart', 'Jonathan Frakes', 'LeVar Burton']",0.7578947368421053,Captain Picard and some of his crew are caught in a deadly trap in the holodeck as the result of a ship-wide scan from an alien race.,0.42857142857142855,0,1992,9
"""Star Trek: Enterprise"" Shadows of P'Jem (TV Episode 2002) - IMDb","['Action', 'Adventure', 'Drama']",['Michael Vejar'],"['Gene Roddenberry', 'Rick Berman', 'Brannon Braga']","['Scott Bakula', 'John Billingsley', 'Jolene Blalock']",0.8105263157894737,T&apos;Pol is being recalled because of Enterprise&apos;s involvement in the destruction of the P&apos;Jem sanctuary. She and Captain Archer are later kidnapped while visiting the planet Coridan.,0.42857142857142855,0,2003,11
"""Star Trek: Enterprise"" Shockwave, Part I (TV Episode 2002) - IMDb","['Action', 'Adventure', 'Drama']",['Allan Kroeker'],"['Gene Roddenberry', 'Rick Berman', 'Brannon Braga']","['Scott Bakula', 'John Billingsley', 'Jolene Blalock']",0.8842105263157896,Enterprise discovers a mining colony of the Paraagans. The crew gets an invitation for a meeting on the surface and a shuttle pod tries to break through the atmosphere. All of a sudden just under the shuttle a giant explosion begi...,0.42857142857142855,0,2003,12
"""Star Trek"" Elaan of Troyius (TV Episode 1968) - IMDb","['Action', 'Adventure', 'Sci-Fi']",['John Meredyth Lucas'],"['Gene Roddenberry', 'John Meredyth Lucas', 'Arthur H. Singer']","['William Shatner', 'Leonard Nimoy', 'DeForest Kelley']",0.7368421052631579,"While transporting an arrogant, demanding princess for a political marriage, Captain Kirk must cope both with her biochemical ability to force him to love her, as well as sabotage on his ship.",0.4857142857142857,0,1968,12
"""Star Trek: The Animated Series"" The Eye of the Beholder (TV Episode 1974) - IMDb","['Animation', 'Action', 'Adventure']",['Hal Sutherland'],"['Gene Roddenberry', 'David P. Harmon', 'D.C. Fontana']","['William Shatner', 'Leonard Nimoy', 'DeForest Kelley']",0.7052631578947368,"While investigating the disappearance of Federation members, Kirk and his landing party find themselves placed in an alien zoo.",0.21904761904761905,0,1974,1
"""The Twilight Zone"" Person or Persons Unknown (TV Episode 1962) - IMDb","['Drama', 'Fantasy', 'Horror']",['John Brahm'],"['Charles Beaumont', 'Rod Serling']","['Richard Long', 'Frank Silvera', 'Shirley Ballard']",0.8210526315789474,"After a night of excess drinking during a neighbor&apos;s party, bank teller David Andrew Gurney wakes up to another ordinary day. Except today, nobody knows who he is - including his own wife Wilma.",0.23809523809523808,0,1962,3
"""Star Trek: Voyager"" State of Flux (TV Episode 1995) - IMDb","['Action', 'Adventure', 'Drama']",['Robert Scheerer'],"['Gene Roddenberry', 'Rick Berman', 'Michael Piller']","['Kate Mulgrew', 'Robert Beltran', 'Roxann Dawson']",0.7999999999999999,"A fatal disaster aboard a Kazon ship reveals mishandled Federation technology at its heart, which indicates a traitor aboard Voyager.",0.4380952380952381,0,1995,4
"""Star Trek: Enterprise"" Future Tense (TV Episode 2003) - IMDb","['Action', 'Adventure', 'Drama']",['James Whitmore Jr.'],"['Gene Roddenberry', 'Rick Berman', 'Brannon Braga']","['Scott Bakula', 'John Billingsley', 'Jolene Blalock']",0.8526315789473684,Enterprise discovers a pod with the body of a human that seems to be wanted by both Sulibans and Tholians.,0.4095238095238095,0,2004,3
"""Star Trek: The Next Generation"" The Game (TV Episode 1991) - IMDb","['Action', 'Adventure', 'Drama']",['Corey Allen'],"['Gene Roddenberry', 'Brannon Braga', 'Susan Sackett']","['Patrick Stewart', 'Jonathan Frakes', 'LeVar Burton']",0.7789473684210527,Wesley Crusher returns to the Enterprise on vacation from the Academy only to discover a mysterious alien game infiltrating and controlling the crew.,0.42857142857142855,0,1991,10
"""The Twilight Zone"" Miniature (TV Episode 1963) - IMDb","['Drama', 'Fantasy', 'Horror']",['Walter Grauman'],"['Charles Beaumont', 'Rod Serling']","['Robert Duvall', 'Pert Kelton', 'Barbara Barrie']",0.7999999999999999,Mousey misfit Charley Parkes finds the world unfolding before him in a museum doll house to be more real than his boring job and overbearing mother.,0.4857142857142857,0,1963,2
"""Star Trek: Deep Space Nine"" What You Leave Behind (TV Episode 1999) - IMDb","['Action', 'Adventure', 'Drama']",['Allan Kroeker'],"['Gene Roddenberry', 'Rick Berman', 'Michael Piller']","['Avery Brooks', 'Rene Auberjonois', 'Nicole de Boer']",0.9368421052631579,"As the Dominion War comes to an end, Dukat goes to the Pah Wraiths to awaken them. Meanwhile the Dominion turn on the rebelling Cardassians, destroying them city by city. Will the Alliance prevail over the Dominion? Will Garak and...",0.8761904761904762,0,1999,6
"""The Twilight Zone"" People Are Alike All Over (TV Episode 1960) - IMDb","['Drama', 'Fantasy', 'Horror']",['Mitchell Leisen'],"['Rod Serling', 'Paul W. Fairman']","['Roddy McDowall', 'Susan Oliver', 'Paul Comi']",0.8526315789473684,"Fearing the worst, the lone survivor of a crash-landing on Mars finds the native inhabitants, to his relief, very hospitable indeed, but there&apos;s a catch.",0.23809523809523808,0,1967,10
"""The Twilight Zone"" The Last Flight (TV Episode 1960) - IMDb","['Drama', 'Fantasy', 'Horror']",['William F. Claxton'],"['Richard Matheson', 'Rod Serling']","['Kenneth Haigh', 'Alexander Scourby', 'Simon Scott']",0.8421052631578947,A World War I British fighter pilot lands at an American air base in 1959 France.,0.23809523809523808,0,1967,10
"""Star Trek: Enterprise"" The Xindi (TV Episode 2003) - IMDb","['Action', 'Adventure', 'Drama']",['Allan Kroeker'],"['Gene Roddenberry', 'Rick Berman', 'Brannon Braga']","['Scott Bakula', 'John Billingsley', 'Jolene Blalock']",0.8105263157894737,"Enterprise has been in the Delphic Expanse for six weeks and have yet to get any intel about the Xindi. Strange anomalies affect the ship, sending cargo flying violently through the bays, pockets of atmosphere losing gravity and o...",0.4095238095238095,0,2004,6
"""The Twilight Zone"" The Hunt (TV Episode 1962) - IMDb","['Drama', 'Fantasy', 'Horror']",['Harold D. Schuster'],"['Earl Hamner Jr.', 'Rod Serling']","['Arthur Hunnicutt', 'Jeanette Nolan', 'Robert Foulk']",0.8315789473684211,"Upon returning from a coon hunt, Hyder Simpson discovers that no one can see or hear him because he has passed on.",0.23809523809523808,0,1962,1
"""Star Trek: Deep Space Nine"" The Visitor (TV Episode 1995) - IMDb","['Action', 'Adventure', 'Drama']",['David Livingston'],"['Gene Roddenberry', 'Rick Berman', 'Michael Piller']","['Avery Brooks', 'Rene Auberjonois', 'Michael Dorn']",0.9578947368421052,"Melanie, an aspiring writer, wants to know why Jake Sisko stopped writing at 40. Jake tells how his father died in an accident and then suddenly reappeared.",0.42857142857142855,0,1995,10
"""Star Trek: Voyager"" Unforgettable (TV Episode 1998) - IMDb","['Action', 'Adventure', 'Drama']",['Andrew Robinson'],"['Gene Roddenberry', 'Rick Berman', 'Michael Piller']","['Kate Mulgrew', 'Robert Beltran', 'Roxann Dawson']",0.6526315789473685,"An alien woman from a closed world seeks asylum aboard Voyager, claiming she&apos;s been there before and that she and Chakotay were lovers, but no one remembers her.",0.4380952380952381,0,1998,4
"""Star Trek: Deep Space Nine"" Let He Who Is without Sin... (TV Episode 1996) - IMDb","['Action', 'Adventure', 'Drama']",['Rene Auberjonois'],"['Gene Roddenberry', 'Rick Berman', 'Michael Piller']","['Avery Brooks', 'Rene Auberjonois', 'Michael Dorn']",0.5789473684210527,"While vacationing on Risa, Worf and Dax meet a group of fundamentalist protesters who claim that the Federation has gone soft.",0.5714285714285714,0,1996,11
"""Star Trek: The Next Generation"" Darmok (TV Episode 1991) - IMDb","['Action', 'Adventure', 'Drama']",['Winrich Kolbe'],"['Gene Roddenberry', 'Joe Menosky', 'Philip LaZebnik']","['Patrick Stewart', 'Jonathan Frakes', 'LeVar Burton']",0.9157894736842105,Picard must learn to communicate with a race that speaks in metaphor under a difficult set of circumstances.,0.4380952380952381,0,1991,9
"""Star Trek: Deep Space Nine"" Waltz (TV Episode 1998) - IMDb","['Action', 'Adventure', 'Drama']",['Rene Auberjonois'],"['Gene Roddenberry', 'Rick Berman', 'Michael Piller']","['Avery Brooks', 'Rene Auberjonois', 'Michael Dorn']",0.8210526315789474,"After being attacked by Cardassian forces, Sisko gets stranded with a very psychotic Gul Dukat, who was being transported to his trial. Meanwhile the crew of the Defiant races to rescue survivors.",0.44761904761904764,0,1998,1
"""Star Trek: The Next Generation"" The Dauphin (TV Episode 1989) - IMDb","['Action', 'Adventure', 'Drama']",['Rob Bowman'],"['Gene Roddenberry', 'Scott Rubenstein', 'Leonard Mlodinow']","['Patrick Stewart', 'Jonathan Frakes', 'LeVar Burton']",0.6526315789473685,"Wesley falls for the young future leader of Daled IV, unaware just how dangerous the girl&apos;s protective and overly restrictive guardian can be.",0.42857142857142855,0,1993,9
"""Futurama"" Kif Gets Knocked Up a Notch (TV Episode 2003) - IMDb","['Animation', 'Adventure', 'Comedy']",['Wesley Archer'],"['Matt Groening', 'David X. Cohen', 'Bill Odenkirk']","['Billy West', 'Katey Sagal', 'John DiMaggio']",0.7894736842105263,Amy is distressed when her alien boyfriend Kif becomes pregnant.,0.21904761904761905,1,2003,1
"""The Twilight Zone"" The Prime Mover (TV Episode 1961) - IMDb","['Drama', 'Fantasy', 'Horror']",['Richard L. Bare'],"['Charles Beaumont', 'Rod Serling']","['Dane Clark', 'Buddy Ebsen', 'Christine White']",0.7368421052631579,Compulsive gambler Ace Larsen cajoles his friend Jimbo Cobb to use his telekinesis to influence the results of the Las Vegas gambling tables in their favor.,0.23809523809523808,0,1961,3
"""Futurama"" Fear of a Bot Planet (TV Episode 1999) - IMDb","['Animation', 'Adventure', 'Comedy']","['Peter Avanzino', 'Carlos Baeza', 'Rich Moore']","['Matt Groening', 'David X. Cohen', 'Evan Gore']","['Billy West', 'Katey Sagal', 'John DiMaggio']",0.8210526315789474,"Fry and Leela disguise themselves as robots to find Bender after he fails to return from a delivery to a robot planet, only to learn that he has become a celebrity in a culture which fears humans.",0.21904761904761905,1,1999,4
"""Star Trek: Deep Space Nine"" Rules of Acquisition (TV Episode 1993) - IMDb","['Action', 'Adventure', 'Drama']",['David Livingston'],"['Gene Roddenberry', 'Rick Berman', 'Michael Piller']","['Avery Brooks', 'Rene Auberjonois', 'Alexander Siddig']",0.7789473684210527,"A female Ferengi named Pel, posing as a male so that she can engage in business, falls for Quark during very important negotiations between the Ferengi and a Gamma Quadrant race.",0.42857142857142855,0,1996,2
Star Trek: Deep Space Nine (TV Series 1993–1999) - IMDb,"['Action', 'Adventure', 'Drama']",[],"['Rick Berman', 'Michael Piller']","['Avery Brooks', 'Rene Auberjonois', 'Cirroc Lofton']",0.8526315789473684,"In the vicinity of the liberated planet of Bajor, the Federation space station Deep Space Nine guards the opening of a stable wormhole to the far side of the galaxy.",0.0,1,1993,1
